{
  "event_type": "quickstart_started",
  "source_system": "agevidence_cli",
  "campaign_account_id": "camp_northstar_au",
  "external_reference": "act_cli_4030",
  "repository_sha": "f4ec679c2dd6a2c40e3dced61c81e8f59f90a397",
  "content_reference": "docs/self-service/DEVELOPER_QUICKSTART.md",
  "occurred_at": "2026-08-04T18:00:00Z",
  "metadata": {
    "path_type": "cli_project_4030"
  }
}
